,bpm,description,file_id,license,name,path,username
351,128,"Electro bass hook progression. Use this as a basis for an electro house track. Add a kick, snare, loop, house leads, fx, whatever you want. 
Tempo is 128 bpm so download it and get to work! ",161948,http://creativecommons.org/publicdomain/zero/1.0/,Power Bass Electro House Synth (SAW+SQUARE).wav,./audio_corpora_freesound/161948_1170148-hq.ogg,joesacco
352,140,heres a heavy little bassline from a song i never finished! Enjoy ! ,162420,http://creativecommons.org/licenses/by-nc/3.0/,Bassy Bass 140bpm,./audio_corpora_freesound/162420_2654859-hq.ogg,mzsound
353,65,melodic sequence low,164356,http://creativecommons.org/publicdomain/zero/1.0/,fx 3 65bpm.wav,./audio_corpora_freesound/164356_2980993-hq.ogg,MrJu07
354,93,Here is a scratch track for taking apart and adding to an audio composition.  The actual sample is 'HUAH!'  It sounds like a crash sample.  ,164808,http://creativecommons.org/publicdomain/zero/1.0/,93bpm_jackgarrison_scratch_dubs1.mp3,./audio_corpora_freesound/164808_2615419-hq.ogg,touchassembly
355,90,Just a little melodic piano solo 90bpm recorded with MIDI keyboard.,165095,http://creativecommons.org/licenses/by/3.0/,piano90bpm.mp3,./audio_corpora_freesound/165095_2329024-hq.ogg,LexArts
356,97,"Sounds created by audio-to-midi feedback loops in Ableton Live.

Quasi-musical sequence.
This sound was created at 97bpm (which affected the Arpegiator speed. Arpegiator step most likely set to 1/12). Please note the tempo of the sound itself may not be 97bpm.

For a more detailed description refer to the sample pack description.

Software and plugins used:
Host: Ableton Live
audio-to-midi conversion: GuitarsynSE by Frettedsynth
main synth: Explor3r Extended by TheLowerRhythm (TLR)
Ableton Live built-in midi effects: Pitch, Scale and Arpegiator

If you want to know more why not send me a PM?",165356,http://creativecommons.org/licenses/by/3.0/,Bleeping_007_(97bpm).wav,./audio_corpora_freesound/165356_97763-hq.ogg,AlienXXX
357,93,Noisy chimes lots of echoing reverb. 93 bpm,165438,http://creativecommons.org/licenses/by/3.0/,noisey chimes 93bpm.wav,./audio_corpora_freesound/165438_1306869-hq.ogg,thatjeffcarter
358,124,"A rendition of this riff:   

<a href=""http://www.freesound.org/people/BDWRekordings.com/sounds/98108/"" rel=""nofollow"">http://www.freesound.org/people/BDWRekordings.com/sounds/98108/</a>

I'm working on a song in D, and I liked this riff when I heard it.  So ran it through Live, adjusted some stuff, and threw some effects etc.  Free to use.  : )",165447,http://creativecommons.org/publicdomain/zero/1.0/,Goa Sounds - Riff_7_124 bpm.wav,./audio_corpora_freesound/165447_2448533-hq.ogg,.Andre_Onate
359,90,A 4 bar drum loop at 90bpm,165469,http://creativecommons.org/licenses/by/3.0/,TailEnd Groove 90bpm.wav,./audio_corpora_freesound/165469_1956076-hq.ogg,Puniho
360,124,"In honor of my new guru Pramahansa Yogananda, I searched for a swan sample.  Then I added: Time stretch, high pass sweep, flange, rotator pann,   delay @ 124 bpm, 

Thank you Guru, Namaste.",165563,http://creativecommons.org/publicdomain/zero/1.0/,Supreme Swan.wav,./audio_corpora_freesound/165563_2448533-hq.ogg,.Andre_Onate
361,110,"Blues riff played on Telecaster in the key of A at 110 bpm. First half is softer, second half is a bit harder. Can be looped.",165855,http://creativecommons.org/licenses/by/3.0/,Blues_Tele_A@110_BPM.aiff,./audio_corpora_freesound/165855_3023152-hq.ogg,guitarelement
362,138,Made this Sound with trancedrive vst plugin.,166003,http://creativecommons.org/licenses/by-nc/3.0/,Cofter gated pad 138 bpm,./audio_corpora_freesound/166003_3020494-hq.ogg,cofter
363,145,"<b>Original File Name</b>: Percussion Groove 4 - 29 September 2012
<b>Specs</b>: 145 bpm, Stereo, 48000 Hz, 24 bit, wav format
<b>Description</b>: Percussion rhythm grooves I programmed into propellerhead's reason's redrum. Samples used come from the ""xclusive hits"" soundbank included in reason for redrum.
<b>Sample pattern</b>: A1 x2 | 0 | A2 x2 | 0 | A3 x2 | 0 | A4 x2 | 0 | A4(fx1) x2 | 0 | A4 (fx1,fx2) x2
<b>Effects</b>: In the beginning, the samples are not equalized, however the whole loop has been passed through an automated equalizer for a sweeping effect (see fx2 above in the patterns) and a swing-echo reverb has been used towards the end as well (see fx1 above).

<i>Contact (pm) me if you want any changes to this sample (please include freesound sample number 166085). You can use this commercially with proper crediting, but please let me know where and how you use it - seeing this used will really make me happy. :)</i>",166085,http://creativecommons.org/publicdomain/zero/1.0/,Percussion Groove 4 - Loops (Wav),./audio_corpora_freesound/166085_2522406-hq.ogg,afleetingspeck
364,85,"<b>Original File Name</b>: Beat 5 - 30 September 2012
<b>Specs</b>: 170 bpm (can use as 85 bpm, too), Stereo, 48000 Hz, 24 bit, wav format
<b>Description</b>: A really simple and rather common loop I programmed into propellerhead's reason's redrum. Includes a bass drum, a rim shot used as a snare, and another one with a ""pop"" sound used as a hi hat. Has a little bit of fx towards the end.
<b>Sample Pattern</b>: A1 | A2 | A3 | A4
<b>Effects</b>: Just equalizers on a couple samples.

<i>Contact (pm) me if you want any changes to this sample (please include freesound sample number 166177). You can use this commercially with proper crediting, but please let me know where and how you use it - seeing this used will really make me happy. :)</i>",166177,http://creativecommons.org/publicdomain/zero/1.0/,Beat 5 - Loop (Wav),./audio_corpora_freesound/166177_2522406-hq.ogg,afleetingspeck
365,115,"<b>Original File Name</b>: Chemical Beat - 2 October 2012
<b>Specs</b>: 115 bpm, Stereo, 48000 Hz, 24 bit, wav format
<b>Description</b>: Another loop I programmed into the redrum module in propellerhead's reason. I used the ""chemical kit 2"" samples that come with the soundbank. The only reason I named this chemical beats is because the samples used were found in the chemical kit patch for redrum. I have no idea what a real chemical beat is supposed to sound like.
Also used the tambourine loop included in the reason soundbank via dr octorex.
<b>Sample Pattern</b>: A1 | A2 | A1+Tamb | A2+Tamb
<b>Effects</b>: Equalized all the samples.

<i>Contact (pm) me if you want any changes to this sample (please include freesound sample number 166272). You can use this commercially with proper crediting, but please let me know where and how you use it - seeing this used will really make me happy. :)</i>
",166272,http://creativecommons.org/publicdomain/zero/1.0/,Chemical Beat - Loop (Wav),./audio_corpora_freesound/166272_2522406-hq.ogg,afleetingspeck
366,140,"Seagulls at Whitby, with a long delay at 140bpm",166704,http://creativecommons.org/publicdomain/zero/1.0/,seagull echo 140bpm.wav,./audio_corpora_freesound/166704_33044-hq.ogg,Snapper4298
367,60,random instruments put together for some background noise. i'm using it for a comedy's background music. It's a simple song that is looped.,166749,http://creativecommons.org/licenses/by-nc/3.0/,wat 60bpm comedy background noise music,./audio_corpora_freesound/166749_2948217-hq.ogg,krytosss
368,60,a little something I put together for a comedy's background music. It's easy to loop at 60bpm. Helps add a little atmosphere.,167388,http://creativecommons.org/licenses/by-nc/3.0/,Bongo Comedy Background Music 60bpm,./audio_corpora_freesound/167388_2948217-hq.ogg,krytosss
369,105,"<b>Original File Name</b>: Weeyow Synth (Space) - 15 October 2012
<b>Specs</b>: Demo at 105 bpm, Stereo, 48000 Hz, 24 bit, wav format
<b>Description</b>: Made in propellerheads reason using the thor polyphonic synthesizer. Used two analog synths, ran through ladder, comb and formant filters and tuned the second analog to 7 semi-tones higher. Analog one is a triangle wave, and analog two is a sine wave.
<b>Sample Pattern</b>: Demo (with portmanteau) | C-1 | C0 | C1 | C2 | C3 | C4 | C5 | C6,
Demo (without portmanteau) | C-1 | C0 | C1 | C2 | C3 | C4 | C5 | C6

<i>Contact (pm) me if you want any changes to this sample (please include freesound sample number 167389). You can use this commercially with proper crediting, but please let me know where and how you use it - seeing this used will really make me happy. :)</i>",167389,http://creativecommons.org/publicdomain/zero/1.0/,Weeyow Synth (Space) - Demo and Notes,./audio_corpora_freesound/167389_2522406-hq.ogg,afleetingspeck
370,110,Funky rhythm part played on Telecaster at 110 bpm. Am7-D9 x 4 and turnaround as F9-E9-Am7-E7.,167390,http://creativecommons.org/licenses/by/3.0/,Funk_Tele_Am@110_bpm.flac,./audio_corpora_freesound/167390_3023152-hq.ogg,guitarelement
371,125,"The track contains 2 ""movement"" parts played around G (G7) chord, 125 bpm, neck and bridge pickup respectively. After there are 4 elements that may be used as a ""spice"" or for modification of the ""movement""",167391,http://creativecommons.org/licenses/by/3.0/,Funky_Tele_G@125_bpm.flac,./audio_corpora_freesound/167391_3023152-hq.ogg,guitarelement
372,100,"This is a blues part with a bit of a haunting feeling to it, played on Les Paul at 100 bpm. There are several parts that can be easily combined and manipulated to your heart's content.",167393,http://creativecommons.org/licenses/by/3.0/,Lespaul Haunting Blues G@100bpm.flac,./audio_corpora_freesound/167393_3023152-hq.ogg,guitarelement
373,90,8bit drum loop at 90bpm,167849,http://creativecommons.org/licenses/by/3.0/,8bit drum loop,./audio_corpora_freesound/167849_2968900-hq.ogg,Keffy.Stay
374,103,a chilled out chord sequence I created in Jeskola Buzz at 103bpm,168259,http://creativecommons.org/publicdomain/zero/1.0/,103_strings.wav,./audio_corpora_freesound/168259_33044-hq.ogg,Snapper4298
375,120,a percussion-loop 120bpm,168747,http://creativecommons.org/licenses/by-nc/3.0/,strange beat - loop 001 - 120.wav,./audio_corpora_freesound/168747_1148376-hq.ogg,cydon
376,90,another 90bpm drumloop,168771,http://creativecommons.org/publicdomain/zero/1.0/,90bpm_drumloop.aif,./audio_corpora_freesound/168771_462105-hq.ogg,LogicMoon
377,40,"I took this Freesound

<a href=""http://www.freesound.org/people/Corsica_S/sounds/104720/"" rel=""nofollow"">http://www.freesound.org/people/Corsica_S/sounds/104720/</a>

and made a Rex loop of it which was then played back at a slow 40bpm. It has CV controlling filters etc and lots of TSAR reverb and echo to give a dark mysterious whispering.",169056,http://creativecommons.org/licenses/by/3.0/,Dark Secret.wav,./audio_corpora_freesound/169056_1956076-hq.ogg,Puniho
378,60,a little something I put together for a comedy's background music. It's easy to loop at 60bpm. Helps add a little atmosphere.,169749,http://creativecommons.org/licenses/by-nc/3.0/,shakey vibes.mp3,./audio_corpora_freesound/169749_2948217-hq.ogg,krytosss
379,60,a little something I put together for a comedy's background music. It's easy to loop at 60bpm. Helps add a little atmosphere.,169750,http://creativecommons.org/licenses/by-nc/3.0/,blubbery wood.mp3,./audio_corpora_freesound/169750_2948217-hq.ogg,krytosss
380,120,Synthbass loop created in Cubase5/Sylenth VST plugin..,169879,http://creativecommons.org/publicdomain/zero/1.0/,Synthbass_120bpm_loop1_C.wav,./audio_corpora_freesound/169879_1881471-hq.ogg,tichec
381,120,"Bassguitar loop - 120 bpm..recorded at EpicSound studio

Bass: Custom shop bass made by mr. Vácha (CZ)

Amp: LINE 6 LOWDOWN HD400

Box1: Gallien-Krueger Neo212 - mic. Shure BETA 52A & Shure SM57

Box2: Vlasa&Black; 1x15 bass - mic. AKG D112",169880,http://creativecommons.org/publicdomain/zero/1.0/,Bassguitar_120bpm_loop1_C.wav,./audio_corpora_freesound/169880_1881471-hq.ogg,tichec
382,120,An 8 bar 120bpm  drum loop made in Reason 6 using a rex loop and mangling it with Groovey Melon's rack extension Morfin FX Crossfader controlled with Pulsar lfos. eq'ed and compressed and a bit of noise-gating to produce these interesting sloppy rhythms.,170446,http://creativecommons.org/licenses/by/3.0/,MorfedUp Loop3.wav,./audio_corpora_freesound/170446_1956076-hq.ogg,Puniho
383,96,"created with drum by dj4real and bass by mrrobot from looperman. 96 bpm, key of b loop",171256,http://creativecommons.org/licenses/by/3.0/,dj4realandmrrobotjamforloop1.mp3,./audio_corpora_freesound/171256_2873260-hq.ogg,burninvernon
384,90,"This is a synth sound I programmed using Reason's Thor polyphonic synthesizer to use on a Freesound ""Dare"" colaboration project. I used two oscs with phase modulation to produce this sound. This file is a four bar loop in D-minor at 90bpm.",171337,http://creativecommons.org/licenses/by/3.0/,Bass Synth.wav,./audio_corpora_freesound/171337_1956076-hq.ogg,Puniho
385,90,"This is a Ghost of Christmas Past! It is made from this Freesound:

<a href=""http://www.freesound.org/people/afleetingspeck/sounds/140697/"" rel=""nofollow"">http://www.freesound.org/people/afleetingspeck/sounds/140697/</a>

Originally used for a Freesound ""Dare"" project earlier this year around last Christmas. I rediscovered the sounds I'd made and thought I should share them with the world. ;O)

I took the guitar sound and looped it  in Reason's Dr Rex. Then heavily processed the loops with lots of effects. I have uploaded the loop at various BPMs.",171350,http://creativecommons.org/licenses/by/3.0/,Dare9 Guitar 90bpm.wav,./audio_corpora_freesound/171350_1956076-hq.ogg,Puniho
386,91,"I played with Roland RD-700GX with a fender sound a 4 bar hiphop-looped version of ""Vois sur ton chemin"" from the movie The children of Monsieu Matthieu"" in 91bpm.",171596,http://creativecommons.org/licenses/by/3.0/,91bpm vois sur ton chemin 4 bar fender hip loop.wav,./audio_corpora_freesound/171596_3191786-hq.ogg,hinzebeat
387,142,Ambient loop. Subtle reverberated icy howling created with synthesizers. Extracted from QPA's psyctrance music production. The tempo is around 142bpm. The sound file is 44.1Khz / 16 bit WAV,171838,http://creativecommons.org/licenses/by-nc/3.0/,Sirius A - Ambient Reverb Ice Cave Howl,./audio_corpora_freesound/171838_537676-hq.ogg,qubenzis
388,170,"A pretty standard 8 bar hardcore beat I made, I used an already distorted drumsound and put an overdrive on it and a maximizer.",172340,http://creativecommons.org/publicdomain/zero/1.0/,Hardcore beat 170 bpm,./audio_corpora_freesound/172340_2687421-hq.ogg,Jessetz
389,124,I created these glitchy percussive noises for a tune I was working on. It was created using Ableton Live.,172633,http://creativecommons.org/licenses/by/3.0/,Perc_01_Resamp_124bpm.wav,./audio_corpora_freesound/172633_93256-hq.ogg,aishabag23
390,74,A somber klezmer style improvisation with a pocket-clarinet and an accordion.,172859,http://creativecommons.org/licenses/by/3.0/,klez_74bpm.wav,./audio_corpora_freesound/172859_840234-hq.ogg,shorthopper
391,130,"Originally a drum loop made in Reason6, rerecorded onto a noisy micro-cassette Then digitised again through a Focusrite SaffirePro24 while playing the tape at double speed.",173287,http://creativecommons.org/licenses/by/3.0/,Taped Drum Loop130bpm.wav,./audio_corpora_freesound/173287_1956076-hq.ogg,Puniho
392,95,a custom midi pattern playing war drums at 95 bpm,173318,http://creativecommons.org/licenses/by/3.0/,collab-2 war drums 95 bpm.wav,./audio_corpora_freesound/173318_18300-hq.ogg,Bliss
393,100,"Originally a Reason Rex drum loop played through effects and re-recorded using a Sanyo micro-cassette tape recorder onto Olympus tape. For some reason this recorder overdubs new recordings without erasing what was already there and I used that as a weird effect. Then digitised again through a Focusrite Saffire Pro24 interface. The loop was at 100bpm, however the tape probably is stretched adn it may need a bit of tweaking to play strictly at 100bpm. ;)",173395,http://creativecommons.org/licenses/by/3.0/,Cassette Drums 100bpm 4.wav,./audio_corpora_freesound/173395_1956076-hq.ogg,Puniho
394,65,Originally a Reason Rex  loop I made of a romantic harp arpeggio played through effects and lfo's and re-recorded using a Sanyo micro-cassette tape recorder onto Olympus tape to get a heavily saturated and distorted analogue sound. Then digitised again through a Focusrite Saffire Pro24 interface. It should loop seamlessly at about 65bpm.,173398,http://creativecommons.org/licenses/by/3.0/,Distorted Harp Arp.wav,./audio_corpora_freesound/173398_1956076-hq.ogg,Puniho
395,93,Here's a useful loop to add an extra spark to a beat,175550,http://creativecommons.org/licenses/by/3.0/,flo x tetra p ii 93 bpm.wav,./audio_corpora_freesound/175550_1818637-hq.ogg,alphasnk
396,135,"135 bpm breakbeat loop for house/garage/dubstep

Plz tell me if you use it. Thx!",175839,http://creativecommons.org/publicdomain/zero/1.0/,garage 135.aif,./audio_corpora_freesound/175839_462105-hq.ogg,LogicMoon
397,140,"140 bpm trance basseline. This is a great basseline for psytrance, darkpsy etc.",176312,http://creativecommons.org/publicdomain/zero/1.0/,Trance_Basseline_140bpm.wav,./audio_corpora_freesound/176312_2998325-hq.ogg,Slina
398,140,"Trance - Lead sound in wav- 140 bpm.
<a href=""http://soundcloud.com/slina"" rel=""nofollow"">http://soundcloud.com/slina</a>",176313,http://creativecommons.org/publicdomain/zero/1.0/,Trance_Lead_140-bpm.wav,./audio_corpora_freesound/176313_2998325-hq.ogg,Slina
399,138,Dark soundscape that could perfectly fit into your dungeon dubstep track or whatever.=) Feel free to post links on your tracks in comments if you use it.,176395,http://creativecommons.org/publicdomain/zero/1.0/,dark_soundscape_138bpm_loop.wav,./audio_corpora_freesound/176395_3232871-hq.ogg,fawkes027
400,79,"A drum loop I made using Ableton's drum rack. At 151.79 bpm, I like how this sounds.",176874,http://creativecommons.org/licenses/by-nc/3.0/,infecticles drum loop 151.79bpm.wav,./audio_corpora_freesound/176874_651383-hq.ogg,mickmon
401,60,White and brown noise modulated at 60 bpm.,176917,http://creativecommons.org/publicdomain/zero/1.0/,Wombpulse.aiff,./audio_corpora_freesound/176917_181941-hq.ogg,klangfabrik
402,60,done on keyboard with audacity fx and mix,177052,http://creativecommons.org/licenses/by-nc/3.0/,keyboard jam in Em 60bpm2.mp3,./audio_corpora_freesound/177052_2873260-hq.ogg,burninvernon
403,190,"Recorder/produced by myself (played by a friend). Originally it was slower, I already cut it and made it faster.

Drums: Premier from the 70's 
Tempo: 190 bpm",178249,http://creativecommons.org/licenses/by-nc/3.0/,Roomy Drumloop,./audio_corpora_freesound/178249_1726621-hq.ogg,_micro
404,115,"My boomy drum sequence produced in Cubase using 4 racks of free VSTi ""DSK SynthDrums"", each layer with it's own effect, / bass / treble and custom reverb on the hats and snare (doubled up for power)",178396,http://creativecommons.org/licenses/by/3.0/,115bpm Manchester Detroit breaks.wav,./audio_corpora_freesound/178396_33044-hq.ogg,Snapper4298
405,135,"The Name says it all mostly.  This sample is @ 135 bpm, with a delay tail to overlap to the next loop.  Please use and enjoy.  ",178447,http://creativecommons.org/publicdomain/zero/1.0/,Lo Fi Modulated Clipped-n-Pitched Tambourines.wav,./audio_corpora_freesound/178447_2448533-hq.ogg,.Andre_Onate
406,135,"A Synth Riff I'm making for a Goa song I'm working on.  This is at 135 bpm and the notes are  F, C#, C, B, G#,   Used the Poizone in FL Studio, Pulse wave with PW modulating, and with a nic portamento.  Enjoy and spread Ohm through Goa.",178541,http://creativecommons.org/publicdomain/zero/1.0/,Goa ynth by Faith.wav,./audio_corpora_freesound/178541_2448533-hq.ogg,.Andre_Onate
407,70,"I made this beat out of a lot of other beats I got off of Freesound, as well as some of my own sounds.",179207,http://creativecommons.org/publicdomain/zero/1.0/,Crazy Beat 70bpm,./audio_corpora_freesound/179207_2866962-hq.ogg,godspine
408,160,C minor dominant 7th chords sustained. Made in Reason 3. Set to 160bpm.,179219,http://creativecommons.org/publicdomain/zero/1.0/,sawtooth pads Cm7.wav,./audio_corpora_freesound/179219_914604-hq.ogg,Ombrios57
409,95,"Dodgy C Build A Beat Project Is Three Loops Pt1,Pt2 and Pt3 Of What I Would Call A Funk/Soul/Hip Hop Style Done So You Can Download The Three Loops And Place Them In A D.A.W And Build A Whole Track Out Of Them Putting The Parts Where You Want Them.
Pt1=Beat and Bass, Pt2=Pt1+Melody and Pt3=Pt2+Hook
As This Is My First Go At Doing Projects This Way If You Think I Should Break The Loops Down Any More Or You Want Seperate Loops e.g Beat Or Bass To Use For Something Else Get In Touch At dodgyc@live.co.uk. All Loops Were Created By Me From Scratch And Are Royalty Free But I Do Like A Mention and a Bit Of Feed Back If Possible!!!!",179358,http://creativecommons.org/licenses/by/3.0/,Dodgy_C_FunkSoul_BuildABeat_Pt2_95bpm.wav,./audio_corpora_freesound/179358_605248-hq.ogg,Dodgy C
410,109,here's a custom drum loop from some handpicked and mixed down drums that I made.,179564,http://creativecommons.org/publicdomain/zero/1.0/,109 bpm 70s style drum loop.wav,./audio_corpora_freesound/179564_2124952-hq.ogg,Corporatist
411,140,"This beat loop was designed to work together with the others in this pack at 140 bpm. 1 beat loop and 2 synth loops. Give them a try if you are experimenting with sampling, or use them in a track.",180657,http://creativecommons.org/publicdomain/zero/1.0/,beatloop,./audio_corpora_freesound/180657_1936965-hq.ogg,luketande
412,82,"Made with FL Studio 10 using STS-33 free (HG Fortune), and then tweaked and morphed into this in Sony Acid Pro 7.",180750,http://creativecommons.org/licenses/by/3.0/,82bpm-spacescape- Cnote 001a.wav,./audio_corpora_freesound/180750_443790-hq.ogg,digitalvalues
413,110,Dry Multi layered claps at 110bpm. ,181138,http://creativecommons.org/publicdomain/zero/1.0/,The Claps,./audio_corpora_freesound/181138_2857162-hq.ogg,ant1e
414,115,"A cowbell loop at 115 bpm, which I made with VST instruments. No eq, compressor, reverb, etc.; normalized to -1 db.",181605,http://creativecommons.org/publicdomain/zero/1.0/,cowbell_115bpm.flac,./audio_corpora_freesound/181605_2794365-hq.ogg,tembelkaptan
415,60,"Increasing heart-beat. From 60 bpm > 200 bpm in 1 minute.

Based on this beat: <a href=""http://www.freesound.org/people/Woodingp/sounds/116642/"" rel=""nofollow"">http://www.freesound.org/people/Woodingp/sounds/116642/</a>


If any of these sounds have been of help, and you are feeling charitable, please do consider<b> <a href=""https://www.freesound.org/donations/donate/"" rel=""nofollow"">donating to Freesound</a> </b>to help keep the site running (a link is also on the home page). Any donations are greatly appreciated!


YOU ALWAYS HAVE TO CREDIT/ATTRIBUTE me (klankbeeld) and freesound.org in your work if you use this sound. 
Please do it like this if possible: <a href=""https://freesound.org/people/klankbeeld/"" rel=""nofollow"">https://freesound.org/people/klankbeeld/</a>
Thank you.
This sound may NOT be used in (royalty free) stock material. Don't put my raw sounds/files on youtube or anywhere else. You can use them in creative way as a part of art-form, but not ""re-distribute"" as (royalty free) stock material. Thank you.",181805,http://creativecommons.org/licenses/by/3.0/,heart beat increasing 116642.wav,./audio_corpora_freesound/181805_1648170-hq.ogg,klankbeeld
416,140,"this is an addition to the original beat with a high hat roll to it, meant to be used in the same song for more intricacies ",182326,http://creativecommons.org/licenses/by/3.0/,Dubstep Simple Beat Cont. 140bpm,./audio_corpora_freesound/182326_3222122-hq.ogg,NoraMeld
417,135,"2 sustained vocal notes
8 bars @ 135bpm
Pay it forward - credit where credit is due.
",182660,http://creativecommons.org/licenses/by/3.0/,Vox1 8b 135bpm.wav,./audio_corpora_freesound/182660_3396866-hq.ogg,bigfriendlyjiant
418,135,Beatbox 16 bar loop at 135 BPM.,183155,http://creativecommons.org/licenses/by/3.0/,loop_135bpm.wav,./audio_corpora_freesound/183155_2140699-hq.ogg,ondrosik
419,180,Drum and bass 16 bar loop at 180 BPM.,183156,http://creativecommons.org/licenses/by/3.0/,loop_180bpm.wav,./audio_corpora_freesound/183156_2140699-hq.ogg,ondrosik
420,135,Just a simple rising frequency sweep made with Ableton's Operator with some added phasing.,183424,http://creativecommons.org/licenses/by/3.0/,Dance Sweep (135bpm).wav,./audio_corpora_freesound/183424_236950-hq.ogg,stair
421,135,"A Drum loop reminiscing early 90s Rave.
A chopped and re-arranged Amen drum loop layered with a 4/4 kick drum and added hi-hats. ",183441,http://creativecommons.org/licenses/by/3.0/,Old School Rave Drum loop (135bpm).wav,./audio_corpora_freesound/183441_236950-hq.ogg,stair
422,115,"Semi real fart loop, disco style. 115 bpm. Merry drum line, clumsy trimmed.  Made with Tone2 Vsti bundle. Recorded in Cubase. <a href=""http://freesound.org/people/zagi2"" rel=""nofollow"">Check out my other stuff.</a>",184321,http://creativecommons.org/licenses/by-nc/3.0/,singing ass-fart loop.wav,./audio_corpora_freesound/184321_3162775-hq.ogg,zagi2
423,142,Glitched loop in 142 bpm halftime,184467,http://creativecommons.org/publicdomain/zero/1.0/,Schnetzlbeat_142.aif,./audio_corpora_freesound/184467_462105-hq.ogg,LogicMoon
424,128,"Drum loop with wobbly bassline. Playing with CamelPhat filters and Sylent1. 128 bpm Recorded in Cubase. <a href=""http://freesound.org/people/zagi2"" rel=""nofollow"">Check out my other stuff.</a>",185130,http://creativecommons.org/licenses/by-nc/3.0/,wobbly loop.wav,./audio_corpora_freesound/185130_3162775-hq.ogg,zagi2
